A1: Week | B1: Day | C1: Date | D1: Vacations and/or cancellations | E1: Book chapter | F1: Lecture material | G1: assignments, quizzes and presentations | H1: relevant assignment content
E2: (Witten unless otherwise stated)
A3: 1 | B3: Mon | C3: 39321 | E3: 4.1 | F3: General intro, 1R | H3: 1a. Self-contained program implementing 1R on nominal weather data set
B4: Thu | C4: 39324 | E4: 4.2 | F4: Naïve Bayes | H4: 2a. Self-contained program implementing 1R and naïve Bayes on nominal weather data and contact lens data
A5: 2 | B5: Mon | C5: =C3+7 -> 39328 | E5: 4.3; Alpaydin 9.1, 9.2, 9.2.1 | F5: Simple decision trees | G5: assignment 1 due | H5: 3.1 decision stumps
B6: Thu | C6: =C4+7 -> 39331 | F6: Group discussion of design for assignment 2 (naïve Bayes classifier implementation) | G6: quiz 1 (1R & naïve Bayes)
A7: 3 | B7: Mon | C7: =C5+7 -> 39335 | E7: 4.7 | F7: Instance-based learning | H7: 3.2 apply knn to iris data using weka; 3.3 comment on weka's IB1 implementation
B8: Thu | C8: =C6+7 -> 39338 | E8: 5 (5.3, 5.6, 5.7, 5.8) | F8: Credibility (cross validation, ROC curves) | G8: assignment 2 due | H8: 3.2 use cross-validation in applying knn to iris data
A9: 4 | B9: Mon | C9: =C7+7 -> 39342 | E9: 10 & 13 | F9: Students work through Weka tutorials on their own and/or work on homework
B10: Thu | C10: =C8+7 -> 39345 | E10: 6.1 | F10: Decision trees revisited (especially C4.5) | G10: quiz 2 (Simple decision trees, instance based learning)
A11: 5 | B11: Mon | C11: =C9+7 -> 39349 | F11: Catchup and homework session
B12: Thu | C12: =C10+7 -> 39352 | E12: Alpaydin 3, Witten 6.7 | F12: Bayesian decision theory and Bayesian networks | G12: assignment 3 due
A13: 6 | B13: Mon | C13: =C11+7 -> 39356 | E13: Alpaydin 3, Witten 6.7 | F13: Bayesian decision theory and Bayesian networks
B14: Thu | C14: =C12+7 -> 39359 | F14: discuss "Detecting Spam Web Pages through Content Analysis", by Ntoulas, Najork, Manasse, and Fetterly | G14: presentations
A15: 7 | B15: Mon | C15: =C13+7 -> 39363 | F15: Catchup and homework session | G15: rough draft of assignment 4 due
B16: Thu | C16: =C14+7 -> 39366 | F16: quiz then discussion with web spam researchers | G16: quiz 3 (Credibility, cross validation, decision tree pruning)
A17: 8 | B17: Mon | C17: =C15+7 -> 39370 | D17: Vacation -- fall pause
B18: Thu | C18: =C16+7 -> 39373 | E18: 7.1, 7.2, Alpaydin 6.2 | F18: Attribute selection, discretization | G18: assignment 4 due
A19: 9 | B19: Mon | C19: =C17+7 -> 39377 | E19: 7.3, Alpaydin 6.3 | F19: PCA
B20: Thu | C20: =C18+7 -> 39380 | F20: discuss "Irrelevant Features and the Subset Selection Problem", by John, Kohavi, and Pfleger | G20: presentations
A21: 10 | B21: Mon | C21: =C19+7 -> 39384 | F21: making a new Weka classifier | G21: email project ideas
B22: Thu | C22: =C20+7 -> 39387 | F22: Preliminary project discussion | G22: quiz 4 (Bayesian decision theory, Bayesian networks, attribute selection, discretization, PCA)
A23: 11 | B23: Mon | C23: =C21+7 -> 39391 | E23: Alpaydin 15.4, 15.5; W&F 7.5 | F23: bagging and boosting
B24: Thu | C24: =C22+7 -> 39394 | E24: Alpaydin 13 | F24: Hidden Markov models | G24: rough draft of assignment 5 due
A25: 12 | B25: Mon | C25: =C23+7 -> 39398 | E25: Alpaydin 13 | F25: Hidden Markov models | G25: interim final project report
B26: Thu | C26: =C24+7 -> 39401 | E26: Alpaydin 13 | F26: Hidden Markov models | G26: assignment 5 due
A27: 13 | B27: Mon | C27: =C25+7 -> 39405 | F27: project discussions | G27: interim final project report
B28: Thu | C28: =C26+7 -> 39408 | D28: Vacation -- Thanksgiving
A29: 14 | B29: Mon | C29: =C27+7 -> 39412 | F29: work on projects | G29: interim final project report
B30: Thu | C30: =C28+7 -> 39415 | F30: work on projects
A31: 15 | B31: Mon | C31: =C29+7 -> 39419 | F31: work on projects | G31: substantial draft of final project due (and the usual interim report)
B32: Thu | C32: =C30+7 -> 39422 | F32: work on projects
A34: 16 | B34: Sat | C34: 39431 | F34: Project presentations | G34: Project presentations and final reports due